{
  "$schema": "https://json-schema.org/draft/2020-12/schema",
  "$id": "https://perfeng.dev/schemas/browser-diagnostics/v1/browser-diagnostics.schema.json",
  "$defs": {
    "id": {
      "type": "string",
      "description": "a string matching the pattern ^[a-z][a-z0-9]*(?:-[a-z0-9]+)*$",
      "pattern": "^[a-z][a-z0-9]*(?:-[a-z0-9]+)*$"
    },
    "workloadIdentity": {
      "type": "object",
      "required": [
        "id",
        "version",
        "profile",
        "sha256"
      ],
      "properties": {
        "id": {
          "$ref": "#/$defs/id"
        },
        "version": {
          "$ref": "#/$defs/version"
        },
        "profile": {
          "type": "string",
          "enum": [
            "smoke",
            "average",
            "regression",
            "stress",
            "capacity",
            "soak"
          ]
        },
        "sha256": {
          "$ref": "#/$defs/sha256"
        }
      },
      "additionalProperties": false
    },
    "version": {
      "type": "string",
      "description": "a string matching the pattern ^(0|[1-9][0-9]*)\\.(0|[1-9][0-9]*)\\.(0|[1-9][0-9]*)$",
      "pattern": "^(0|[1-9][0-9]*)\\.(0|[1-9][0-9]*)\\.(0|[1-9][0-9]*)$"
    },
    "sha256": {
      "type": "string",
      "description": "a string matching the pattern ^[a-f0-9]{64}$",
      "pattern": "^[a-f0-9]{64}$"
    },
    "timestamp": {
      "type": "string",
      "format": "date-time",
      "description": "a string matching the pattern ^\\d{4}-\\d{2}-\\d{2}T\\d{2}:\\d{2}:[0-5]\\d(?:\\.\\d{1,6})?(?:Z|[+-]\\d{2}:\\d{2})$",
      "pattern": "^\\d{4}-\\d{2}-\\d{2}T\\d{2}:\\d{2}:[0-5]\\d(?:\\.\\d{1,6})?(?:Z|[+-]\\d{2}:\\d{2})$"
    },
    "capture": {
      "type": "object",
      "required": [
        "type",
        "scope",
        "status",
        "reasons",
        "sensitive"
      ],
      "properties": {
        "type": {
          "type": "string",
          "enum": [
            "observations",
            "network-summary",
            "console",
            "trace",
            "cpu-profile",
            "heap-snapshot-before",
            "heap-snapshot-after",
            "allocation-profile",
            "screenshot",
            "video"
          ]
        },
        "scope": {
          "anyOf": [
            {
              "type": "object",
              "required": [
                "kind"
              ],
              "properties": {
                "kind": {
                  "type": "string",
                  "enum": [
                    "run"
                  ]
                }
              },
              "additionalProperties": false
            },
            {
              "type": "object",
              "required": [
                "kind",
                "iteration"
              ],
              "properties": {
                "kind": {
                  "type": "string",
                  "enum": [
                    "iteration"
                  ]
                },
                "iteration": {
                  "type": "integer",
                  "description": "a number greater than or equal to 1",
                  "title": "greaterThanOrEqualTo(1)",
                  "minimum": 1
                }
              },
              "additionalProperties": false
            }
          ]
        },
        "status": {
          "type": "string",
          "enum": [
            "COMPLETE",
            "INCOMPLETE",
            "FAILED",
            "NOT_SUPPORTED"
          ]
        },
        "reasons": {
          "type": "array",
          "items": {
            "type": "string",
            "description": "a string at least 1 character(s) long",
            "title": "minLength(1)",
            "minLength": 1
          },
          "uniqueItems": true
        },
        "sensitive": {
          "type": "boolean"
        },
        "dataLossOccurred": {
          "anyOf": [
            {
              "type": "boolean"
            },
            {
              "type": "null"
            }
          ]
        },
        "artifact": {
          "type": "object",
          "required": [
            "id",
            "runId",
            "kind",
            "uri",
            "sha256",
            "sizeBytes",
            "mediaType",
            "format"
          ],
          "properties": {
            "id": {
              "type": "string",
              "format": "uuid"
            },
            "runId": {
              "type": "string",
              "description": "Reference to the run metadata",
              "pattern": "^perf-[0-9]{8}-[0-9]{6}-[a-f0-9]{8}$"
            },
            "kind": {
              "type": "string",
              "enum": [
                "raw"
              ]
            },
            "uri": {
              "type": "string",
              "format": "uri",
              "description": "a string matching the pattern ^(s3|https):\\/\\/[^\\s?#]+$",
              "pattern": "^(s3|https):\\/\\/[^\\s?#]+$"
            },
            "sha256": {
              "$ref": "#/$defs/sha256"
            },
            "sizeBytes": {
              "type": "integer",
              "description": "a non-negative number",
              "title": "greaterThanOrEqualTo(0)",
              "minimum": 0
            },
            "mediaType": {
              "type": "string",
              "description": "a string matching the pattern ^[a-z0-9][a-z0-9!#$&^_.+-]*\\/[a-z0-9][a-z0-9!#$&^_.+-]*$",
              "pattern": "^[a-z0-9][a-z0-9!#$&^_.+-]*\\/[a-z0-9][a-z0-9!#$&^_.+-]*$"
            },
            "format": {
              "type": "string",
              "description": "a string matching the pattern ^[a-z0-9][a-z0-9./_-]*$",
              "title": "minLength(1)",
              "minLength": 1,
              "pattern": "^[a-z0-9][a-z0-9./_-]*$"
            }
          },
          "additionalProperties": false
        }
      },
      "additionalProperties": false,
      "allOf": [
        {
          "if": {
            "properties": {
              "status": {
                "enum": [
                  "COMPLETE",
                  "INCOMPLETE"
                ]
              }
            }
          },
          "then": {
            "required": [
              "artifact"
            ]
          },
          "else": {
            "not": {
              "required": [
                "artifact"
              ]
            }
          }
        },
        {
          "if": {
            "properties": {
              "status": {
                "const": "COMPLETE"
              }
            }
          },
          "then": {
            "properties": {
              "reasons": {
                "maxItems": 0
              }
            }
          },
          "else": {
            "properties": {
              "reasons": {
                "minItems": 1
              }
            }
          }
        },
        {
          "if": {
            "properties": {
              "type": {
                "const": "trace"
              }
            }
          },
          "then": {
            "required": [
              "dataLossOccurred"
            ]
          },
          "else": {
            "not": {
              "required": [
                "dataLossOccurred"
              ]
            }
          }
        }
      ]
    }
  },
  "type": "object",
  "required": [
    "schemaVersion",
    "kind",
    "runId",
    "testId",
    "workload",
    "environment",
    "execution",
    "sources",
    "captureWindow",
    "captures",
    "createdAt"
  ],
  "properties": {
    "schemaVersion": {
      "type": "number",
      "enum": [
        1
      ]
    },
    "kind": {
      "type": "string",
      "enum": [
        "BrowserDiagnostics"
      ]
    },
    "runId": {
      "type": "string",
      "description": "Reference to the run metadata",
      "pattern": "^perf-[0-9]{8}-[0-9]{6}-[a-f0-9]{8}$"
    },
    "testId": {
      "$ref": "#/$defs/id"
    },
    "workload": {
      "$ref": "#/$defs/workloadIdentity"
    },
    "environment": {
      "type": "object",
      "required": [
        "profile",
        "fingerprint",
        "artifact"
      ],
      "properties": {
        "profile": {
          "type": "object",
          "required": [
            "id",
            "version"
          ],
          "properties": {
            "id": {
              "$ref": "#/$defs/id"
            },
            "version": {
              "$ref": "#/$defs/version"
            }
          },
          "additionalProperties": false
        },
        "fingerprint": {
          "$ref": "#/$defs/sha256"
        },
        "artifact": {
          "type": "object",
          "required": [
            "id",
            "runId",
            "kind",
            "uri",
            "sha256",
            "sizeBytes",
            "mediaType",
            "format"
          ],
          "properties": {
            "id": {
              "type": "string",
              "format": "uuid"
            },
            "runId": {
              "type": "string",
              "description": "Reference to the run metadata",
              "pattern": "^perf-[0-9]{8}-[0-9]{6}-[a-f0-9]{8}$"
            },
            "kind": {
              "type": "string",
              "enum": [
                "raw"
              ]
            },
            "uri": {
              "type": "string",
              "format": "uri",
              "description": "a string matching the pattern ^(s3|https):\\/\\/[^\\s?#]+$",
              "pattern": "^(s3|https):\\/\\/[^\\s?#]+$"
            },
            "sha256": {
              "$ref": "#/$defs/sha256"
            },
            "sizeBytes": {
              "type": "integer",
              "description": "a non-negative number",
              "title": "greaterThanOrEqualTo(0)",
              "minimum": 0
            },
            "mediaType": {
              "type": "string",
              "enum": [
                "application/json"
              ]
            },
            "format": {
              "type": "string",
              "enum": [
                "browser-environment/v1"
              ]
            }
          },
          "additionalProperties": false
        }
      },
      "additionalProperties": false
    },
    "execution": {
      "type": "object",
      "required": [
        "mode",
        "contextReuse",
        "pageReuse",
        "captureIterations"
      ],
      "properties": {
        "mode": {
          "type": "string",
          "enum": [
            "lightweight",
            "trace",
            "memory",
            "smoothness"
          ]
        },
        "contextReuse": {
          "type": "string",
          "enum": [
            "per-iteration",
            "per-run"
          ]
        },
        "pageReuse": {
          "type": "string",
          "enum": [
            "per-iteration",
            "per-run"
          ]
        },
        "captureIterations": {
          "type": "array",
          "items": {
            "type": "integer",
            "description": "a number greater than or equal to 1",
            "title": "greaterThanOrEqualTo(1)",
            "minimum": 1
          },
          "uniqueItems": true,
          "description": "an array of at least 1 item(s)",
          "title": "minItems(1)",
          "minItems": 1
        }
      },
      "additionalProperties": false
    },
    "sources": {
      "type": "array",
      "items": {
        "type": "string",
        "enum": [
          "playwright",
          "web-performance",
          "cdp",
          "windows"
        ]
      },
      "uniqueItems": true,
      "description": "an array of at least 1 item(s)",
      "title": "minItems(1)",
      "minItems": 1
    },
    "captureWindow": {
      "type": "object",
      "required": [
        "start",
        "end"
      ],
      "properties": {
        "start": {
          "$ref": "#/$defs/timestamp"
        },
        "end": {
          "$ref": "#/$defs/timestamp"
        }
      },
      "additionalProperties": false
    },
    "captures": {
      "type": "array",
      "items": {
        "$ref": "#/$defs/capture"
      },
      "description": "an array of at least 1 item(s)",
      "title": "minItems(1)",
      "minItems": 1
    },
    "createdAt": {
      "$ref": "#/$defs/timestamp"
    }
  },
  "additionalProperties": false,
  "title": "Browser diagnostic capture manifest"
}
